PMID,Title,Authors,Citation,First Author,Journal/Book,Publication Year,Create Date
30976418,Clinical characteristics and outcomes of patients with severe acute respiratory infections (SARI): results from the Egyptian surveillance study 2010-2014,"Hatem A, Mohamed S, Abu Elhassan UE, Ismael EAM, Rizk MS, El-Kholy A, El-Harras M.",Multidiscip Respir Med. 2019 Apr 1;14:11. doi: 10.1186/s40248-019-0174-7. eCollection 2019.,Hatem A,Multidiscip Respir Med,2019,2019/04/13
30955800,Cholesterol 25-hydroxylase negatively regulates porcine intestinal coronavirus replication by the production of 25-hydroxycholesterol,"Zhang Y, Song Z, Wang M, Lan M, Zhang K, Jiang P, Li Y, Bai J, Wang X.",Vet Microbiol. 2019 Apr;231:129-138. doi: 10.1016/j.vetmic.2019.03.004. Epub 2019 Mar 6.,Zhang Y,Vet Microbiol,2019,2019/04/09
30955799,Assessment of the safety and efficacy of an attenuated live vaccine based on highly virulent genotype 2b porcine epidemic diarrhea virus in nursing piglets,"Jang G, Won H, Lee DU, Noh YH, Lee SC, Choi HW, Yoon IJ, Lee YJ, Sang Yoo H, Lee C.",Vet Microbiol. 2019 Apr;231:120-128. doi: 10.1016/j.vetmic.2019.03.009. Epub 2019 Mar 11.,Jang G,Vet Microbiol,2019,2019/04/09
30882305,"Middle East Respiratory Syndrome Coronavirus Infection Dynamics and Antibody Responses among Clinically Diverse Patients, Saudi Arabia","Al-Abdely HM, Midgley CM, Alkhamis AM, Abedi GR, Lu X, Binder AM, Alanazi KH, Tamin A, Banjar WM, Lester S, Abdalla O, Dahl RM, Mohammed M, Trivedi S, Algarni HS, Sakthivel SK, Algwizani A, Bafaqeeh F, Alzahrani A, Alsharef AA, Alhakeem RF, Jokhdar HAA, Ghazal SS, Thornburg NJ, Erdman DD, Assiri AM, Watson JT, Gerber SI.",Emerg Infect Dis. 2019 Apr;25(4):753-766. doi: 10.3201/eid2504.181595.,Al-Abdely HM,Emerg Infect Dis,2019,2019/03/19
30877663,"Divergent coronaviruses detected in wild birds in Brazil, including a central park in São Paulo","Barbosa CM, Durigon EL, Thomazelli LM, Ometto T, Marcatti R, Nardi MS, de Aguiar DM, Pinho JB, Petry MV, Neto IS, Serafini P, Rodrigues RC, de Azevedo Junior SM, Góes LGB, de Araujo J.",Braz J Microbiol. 2019 Apr;50(2):547-556. doi: 10.1007/s42770-019-00065-7. Epub 2019 Mar 15.,Barbosa CM,Braz J Microbiol,2019,2019/03/17
30855219,Construction of a Recombinant Lactococcus lactis Strain Expressing a Variant Porcine Epidemic Diarrhea Virus S1 Gene and Its Immunogenicity Analysis in Mice,"Guo M, Yi S, Guo Y, Zhang S, Niu J, Wang K, Hu G.",Viral Immunol. 2019 Apr;32(3):144-150. doi: 10.1089/vim.2018.0108. Epub 2019 Mar 11.,Guo M,Viral Immunol,2019,2019/03/12
30849247,Broad-spectrum coronavirus antiviral drug discovery,"Totura AL, Bavari S.",Expert Opin Drug Discov. 2019 Apr;14(4):397-412. doi: 10.1080/17460441.2019.1581171. Epub 2019 Mar 8.,Totura AL,Expert Opin Drug Discov,2019,2019/03/09
30799511,Porcine epidemic diarrhea virus nsp4 induces pro-inflammatory cytokine and chemokine expression inhibiting viral replication in vitro,"Yu L, Dong J, Wang Y, Zhang P, Liu Y, Zhang L, Liang P, Wang L, Song C.",Arch Virol. 2019 Apr;164(4):1147-1157. doi: 10.1007/s00705-019-04176-2. Epub 2019 Feb 24.,Yu L,Arch Virol,2019,2019/02/26
30784880,"Chemical synthesis, crystal structure, versatile evaluation of their biological activities and molecular simulations of novel pyrithiobac derivatives","Wu RJ, Zhou KX, Yang H, Song GQ, Li YH, Fu JX, Zhang X, Yu SJ, Wang LZ, Xiong LX, Niu CW, Song FH, Yang H, Wang JG.",Eur J Med Chem. 2019 Apr 1;167:472-484. doi: 10.1016/j.ejmech.2019.02.002. Epub 2019 Feb 14.,Wu RJ,Eur J Med Chem,2019,2019/02/21
30784764,Tumor suppressor p53 inhibits porcine epidemic diarrhea virus infection via interferon-mediated antiviral immunity,"Hao Z, Fu F, Cao L, Guo L, Liu J, Xue M, Feng L.",Mol Immunol. 2019 Apr;108:68-74. doi: 10.1016/j.molimm.2019.02.005. Epub 2019 Feb 18.,Hao Z,Mol Immunol,2019,2019/02/21
30758768,Whole genome characterisation of quail deltacoronavirus detected in Poland,"Domańska-Blicharz K, Kuczkowski M, Sajewicz-Krukowska J.",Virus Genes. 2019 Apr;55(2):243-247. doi: 10.1007/s11262-019-01639-1. Epub 2019 Feb 13.,Domańska-Blicharz K,Virus Genes,2019,2019/02/14
30738233,The 3D8 single chain variable fragment protein suppress infectious bronchitis virus transmission in the transgenic chickens,"Lee G, Choi H, Sureshkumar S, Jung SK, Kim JS, Oh KB, Kim KW, Yang H, Kim DH, Byun SJ.",Res Vet Sci. 2019 Apr;123:293-297. doi: 10.1016/j.rvsc.2019.01.025. Epub 2019 Jan 23.,Lee G,Res Vet Sci,2019,2019/02/10
30735813,Geographical structure of bat SARS-related coronaviruses,"Yu P, Hu B, Shi ZL, Cui J.",Infect Genet Evol. 2019 Apr;69:224-229. doi: 10.1016/j.meegid.2019.02.001. Epub 2019 Feb 6.,Yu P,Infect Genet Evol,2019,2019/02/09
30735700,Development of a SYBR green I-based duplex real-time fluorescence quantitative PCR assay for the simultaneous detection of porcine epidemic diarrhea virus and porcine circovirus 3,"Han HY, Zheng HH, Zhao Y, Tian RB, Xu PL, Hou HL, Chen HY, Yang MF.",Mol Cell Probes. 2019 Apr;44:44-50. doi: 10.1016/j.mcp.2019.02.002. Epub 2019 Feb 5.,Han HY,Mol Cell Probes,2019,2019/02/09
30729994,Construction and characterization of porcine single-chain fragment variable antibodies that neutralize transmissible gastroenteritis virus in vitro,"Zhang F, Chen Y, Yang L, Zhu J.",Arch Virol. 2019 Apr;164(4):983-994. doi: 10.1007/s00705-019-04156-6. Epub 2019 Feb 7.,Zhang F,Arch Virol,2019,2019/02/08
30725181,Molecular characteristics of a novel recombinant of porcine epidemic diarrhea virus,"Nefedeva M, Titov I, Malogolovkin A.",Arch Virol. 2019 Apr;164(4):1199-1204. doi: 10.1007/s00705-019-04166-4. Epub 2019 Feb 6.,Nefedeva M,Arch Virol,2019,2019/02/07
30723301,Respiratory syncytial virus entry and how to block it,"Battles MB, McLellan JS.",Nat Rev Microbiol. 2019 Apr;17(4):233-245. doi: 10.1038/s41579-019-0149-x.,Battles MB,Nat Rev Microbiol,2019,2019/02/07
30690213,Macrolides in critically ill patients with Middle East Respiratory Syndrome,"Arabi YM, Deeb AM, Al-Hameed F, Mandourah Y, Almekhlafi GA, Sindi AA, Al-Omari A, Shalhoub S, Mady A, Alraddadi B, Almotairi A, Al Khatib K, Abdulmomen A, Qushmaq I, Solaiman O, Al-Aithan AM, Al-Raddadi R, Ragab A, Al Harthy A, Kharaba A, Jose J, Dabbagh T, Fowler RA, Balkhy HH, Merson L, Hayden FG; Saudi Critical Care Trials group.",Int J Infect Dis. 2019 Apr;81:184-190. doi: 10.1016/j.ijid.2019.01.041. Epub 2019 Jan 25.,Arabi YM,Int J Infect Dis,2019,2019/01/29
30682525,Epidemiology of porcine epidemic diarrhea virus among Chinese pig populations: A meta-analysis,"Chen X, Zhang XX, Li C, Wang H, Wang H, Meng XZ, Ma J, Ni HB, Zhang X, Qi Y, Sun D.",Microb Pathog. 2019 Apr;129:43-49. doi: 10.1016/j.micpath.2019.01.017. Epub 2019 Jan 23.,Chen X,Microb Pathog,2019,2019/01/26
30677534,Genetic evolution analysis and pathogenicity assessment of porcine epidemic diarrhea virus strains circulating in part of China during 2011-2017,"Chen P, Wang K, Hou Y, Li H, Li X, Yu L, Jiang Y, Gao F, Tong W, Yu H, Yang Z, Tong G, Zhou Y.",Infect Genet Evol. 2019 Apr;69:153-165. doi: 10.1016/j.meegid.2019.01.022. Epub 2019 Jan 21.,Chen P,Infect Genet Evol,2019,2019/01/25
30637608,In vitro antiviral activity of Griffithsin against porcine epidemic diarrhea virus,"Li L, Yu X, Zhang H, Cheng H, Hou L, Zheng Q, Hou J.",Virus Genes. 2019 Apr;55(2):174-181. doi: 10.1007/s11262-019-01633-7. Epub 2019 Jan 14.,Li L,Virus Genes,2019,2019/01/15
30632017,Nasal virome of dogs with respiratory infection signs include novel taupapillomaviruses,"Altan E, Seguin MA, Leutenegger CM, Phan TG, Deng X, Delwart E.",Virus Genes. 2019 Apr;55(2):191-197. doi: 10.1007/s11262-019-01634-6. Epub 2019 Jan 10.,Altan E,Virus Genes,2019,2019/01/12
30518248,Induction of IBV strain-specific neutralizing antibodies and broad spectrum protection in layer pullets primed with IBV Massachusetts (Mass) and 793B vaccines prior to injection of inactivated vaccine containing Mass antigen,"de Wit JJS, Malo A, Cook JKA.",Avian Pathol. 2019 Apr;48(2):135-147. doi: 10.1080/03079457.2018.1556778. Epub 2019 Jan 4.,de Wit JJS,Avian Pathol,2019,2018/12/07
30476311,"Effects of beta-1,3-glucan (AletaTM) on vaccination response in broiler chickens","Horst G, Levine R, Chick R, Hofacre C.",Poult Sci. 2019 Apr 1;98(4):1643-1647. doi: 10.3382/ps/pey523.,Horst G,Poult Sci,2019,2018/11/27
30935078,The N-Terminal Domain of Spike Protein Is Not the Enteric Tropism Determinant for Transmissible Gastroenteritis Virus in Piglets,"Wang G, Liang R, Liu Z, Shen Z, Shi J, Shi Y, Deng F, Xiao S, Fu ZF, Peng G.",Viruses. 2019 Mar 30;11(4):313. doi: 10.3390/v11040313.,Wang G,Viruses,2019,2019/04/03
30925168,"Bayesian inference of transmission chains using timing of symptoms, pathogen genomes and contact data","Campbell F, Cori A, Ferguson N, Jombart T.",PLoS Comput Biol. 2019 Mar 29;15(3):e1006930. doi: 10.1371/journal.pcbi.1006930. eCollection 2019 Mar.,Campbell F,PLoS Comput Biol,2019,2019/03/30
30808716,Mucosal immune responses induced by oral administration recombinant Bacillus subtilis expressing the COE antigen of PEDV in newborn piglets,"Wang J, Huang L, Mou C, Zhang E, Wang Y, Cao Y, Yang Q.",Biosci Rep. 2019 Mar 15;39(3):BSR20182028. doi: 10.1042/BSR20182028. Print 2019 Mar 29.,Wang J,Biosci Rep,2019,2019/02/28
29447395,Characteristics and Outcomes of Coronavirus Infection in Children: The Role of Viral Factors and an Immunocompromised State,"Ogimi C, Englund JA, Bradford MC, Qin X, Boeckh M, Waghmare A.",J Pediatric Infect Dis Soc. 2019 Mar 28;8(1):21-28. doi: 10.1093/jpids/pix093.,Ogimi C,J Pediatric Infect Dis Soc,2019,2018/02/16
30984127,"Recent Aspects on the Pathogenesis Mechanism, Animal Models and Novel Therapeutic Interventions for Middle East Respiratory Syndrome Coronavirus Infections","Skariyachan S, Challapilli SB, Packirisamy S, Kumargowda ST, Sridhar VS.",Front Microbiol. 2019 Mar 26;10:569. doi: 10.3389/fmicb.2019.00569. eCollection 2019.,Skariyachan S,Front Microbiol,2019,2019/04/16
30914508,Antagonism of dsRNA-Induced Innate Immune Pathways by NS4a and NS4b Accessory Proteins during MERS Coronavirus Infection,"Comar CE, Goldstein SA, Li Y, Yount B, Baric RS, Weiss SR.",mBio. 2019 Mar 26;10(2):e00319-19. doi: 10.1128/mBio.00319-19.,Comar CE,mBio,2019,2019/03/28
30850426,Frequency of molecular detection of equine coronavirus in faeces and nasal secretions in 277 horses with acute onset of fever,"Pusterla N, James K, Mapes S, Bain F.",Vet Rec. 2019 Mar 23;184(12):385. doi: 10.1136/vr.104919. Epub 2019 Mar 8.,Pusterla N,Vet Rec,2019,2019/03/10
30915222,Guillain-Barré syndrome with unilateral peripheral facial and bulbar palsy in a child: A case report,"Sharma K, Tengsupakul S, Sanchez O, Phaltas R, Maertens P.",SAGE Open Med Case Rep. 2019 Mar 21;7:2050313X19838750. doi: 10.1177/2050313X19838750. eCollection 2019.,Sharma K,SAGE Open Med Case Rep,2019,2019/03/28
30898086,The perceived effectiveness of MERS-CoV educational programs and knowledge transfer among primary healthcare workers: a cross-sectional survey,"Aldohyan M, Al-Rawashdeh N, Sakr FM, Rahman S, Alfarhan AI, Salam M.",BMC Infect Dis. 2019 Mar 21;19(1):273. doi: 10.1186/s12879-019-3898-2.,Aldohyan M,BMC Infect Dis,2019,2019/03/23
30897856,A Single V672F Substitution in the Spike Protein of Field-Isolated PEDV Promotes Cell⁻Cell Fusion and Replication in VeroE6 Cells,"Wanitchang A, Saenboonrueng J, Kaewborisuth C, Srisutthisamphan K, Jongkaewwattana A.",Viruses. 2019 Mar 20;11(3):282. doi: 10.3390/v11030282.,Wanitchang A,Viruses,2019,2019/03/23
30893947,Host Determinants of MERS-CoV Transmission and Pathogenesis,"Widagdo W, Sooksawasdi Na Ayudhya S, Hundie GB, Haagmans BL.",Viruses. 2019 Mar 19;11(3):280. doi: 10.3390/v11030280.,Widagdo W,Viruses,2019,2019/03/22
30626688,TMPRSS2 Contributes to Virus Spread and Immunopathology in the Airways of Murine Models after Coronavirus Infection,"Iwata-Yoshikawa N, Okamura T, Shimizu Y, Hasegawa H, Takeda M, Nagata N.",J Virol. 2019 Mar 5;93(6):e01815-18. doi: 10.1128/JVI.01815-18. Print 2019 Mar 15.,Iwata-Yoshikawa N,J Virol,2019,2019/01/11
30626685,Acute Respiratory Infection in Human Dipeptidyl Peptidase 4-Transgenic Mice Infected with Middle East Respiratory Syndrome Coronavirus,"Iwata-Yoshikawa N, Okamura T, Shimizu Y, Kotani O, Sato H, Sekimukai H, Fukushi S, Suzuki T, Sato Y, Takeda M, Tashiro M, Hasegawa H, Nagata N.",J Virol. 2019 Mar 5;93(6):e01818-18. doi: 10.1128/JVI.01818-18. Print 2019 Mar 15.,Iwata-Yoshikawa N,J Virol,2019,2019/01/11
30567993,Tetraspanins: Architects of Viral Entry and Exit Platforms,"Hantak MP, Qing E, Earnest JT, Gallagher T.",J Virol. 2019 Mar 5;93(6):e01429-17. doi: 10.1128/JVI.01429-17. Print 2019 Mar 15.,Hantak MP,J Virol,2019,2018/12/21
30871190,Construction and Immunogenicity of Novel Chimeric Virus-Like Particles Bearing Antigens of Infectious Bronchitis Virus and Newcastle Disease Virus,"Wu X, Zhai X, Lai Y, Zuo L, Zhang Y, Mei X, Xiang R, Kang Z, Zhou L, Wang H.",Viruses. 2019 Mar 13;11(3):254. doi: 10.3390/v11030254.,Wu X,Viruses,2019,2019/03/16
30867325,Evaluation of the Serologic Cross-Reactivity between Transmissible Gastroenteritis Coronavirus and Porcine Respiratory Coronavirus Using Commercial Blocking Enzyme-Linked Immunosorbent Assay Kits,"Magtoto R, Poonsuk K, Baum D, Zhang J, Chen Q, Ji J, Piñeyro P, Zimmerman J, Giménez-Lirola LG.",mSphere. 2019 Mar 13;4(2):e00017-19. doi: 10.1128/mSphere.00017-19.,Magtoto R,mSphere,2019,2019/03/15
30857374,Bat Research Networks and Viral Surveillance: Gaps and Opportunities in Western Asia,"Phelps KL, Hamel L, Alhmoud N, Ali S, Bilgin R, Sidamonidze K, Urushadze L, Karesh W, Olival KJ.",Viruses. 2019 Mar 10;11(3):240. doi: 10.3390/v11030240.,Phelps KL,Viruses,2019,2019/03/13
30850666,Decline of transmissible gastroenteritis virus and its complex evolutionary relationship with porcine respiratory coronavirus in the United States,"Chen F, Knutson TP, Rossow S, Saif LJ, Marthaler DG.",Sci Rep. 2019 Mar 8;9(1):3953. doi: 10.1038/s41598-019-40564-z.,Chen F,Sci Rep,2019,2019/03/10
30863824,First Complete Genome Sequence of a Feline Alphacoronavirus 1 Strain from Brazil,"de Barros BCV, de Castro CMO, Pereira D, Ribeiro LG, Júnior JWBD, Casseb SMM, Holanda GM, Cruz ACR, Júnior ECS, Mascarenhas JDP.",Microbiol Resour Announc. 2019 Mar 7;8(10):e01535-18. doi: 10.1128/MRA.01535-18. eCollection 2019 Mar.,de Barros BCV,Microbiol Resour Announc,2019,2019/03/14
30847572,An electrochemical immunosensor for the corona virus associated with the Middle East respiratory syndrome using an array of gold nanoparticle-modified carbon electrodes,"Layqah LA, Eissa S.",Mikrochim Acta. 2019 Mar 7;186(4):224. doi: 10.1007/s00604-019-3345-5.,Layqah LA,Mikrochim Acta,2019,2019/03/09
30840701,Growth enhancement of porcine epidemic diarrhea virus (PEDV) in Vero E6 cells expressing PEDV nucleocapsid protein,"Liwnaree B, Narkpuk J, Sungsuwan S, Jongkaewwattana A, Jaru-Ampornpan P.",PLoS One. 2019 Mar 6;14(3):e0212632. doi: 10.1371/journal.pone.0212632. eCollection 2019.,Liwnaree B,PLoS One,2019,2019/03/07
30840679,Phylogeographic investigation of 2014 porcine epidemic diarrhea virus (PEDV) transmission in Taiwan,"Sung MH, Lin CN, Chiou MT, Cheng IJ, Thanh QH, Chao DY, Lan YC.",PLoS One. 2019 Mar 6;14(3):e0213153. doi: 10.1371/journal.pone.0213153. eCollection 2019.,Sung MH,PLoS One,2019,2019/03/07
30840626,Pneumonia severity index in viral community acquired pneumonia in adults,"Kim MA, Park JS, Lee CW, Choi WI.",PLoS One. 2019 Mar 6;14(3):e0210102. doi: 10.1371/journal.pone.0210102. eCollection 2019.,Kim MA,PLoS One,2019,2019/03/07
30184178,"Clinical and Epidemiologic Patterns of Chikungunya Virus Infection and Coincident Arboviral Disease in a School Cohort in Haiti, 2014-2015","Ball JD, Elbadry MA, Telisma T, White SK, Chavannes S, Anilis MG, Prosperi M, Cummings DAT, Lednicky JA, Morris JG, Beau de Rochars M.",Clin Infect Dis. 2019 Mar 5;68(6):919-926. doi: 10.1093/cid/ciy582.,Ball JD,Clin Infect Dis,2019,2018/09/06
30060038,Immune Responses to Middle East Respiratory Syndrome Coronavirus During the Acute and Convalescent Phases of Human Infection,"Shin HS, Kim Y, Kim G, Lee JY, Jeong I, Joh JS, Kim H, Chang E, Sim SY, Park JS, Lim DG.",Clin Infect Dis. 2019 Mar 5;68(6):984-992. doi: 10.1093/cid/ciy595.,Shin HS,Clin Infect Dis,2019,2018/07/31
30830947,Multiplex PCR methods for detection of several viruses associated with canine respiratory and enteric diseases,"Hao X, Liu R, He Y, Xiao X, Xiao W, Zheng Q, Lin X, Tao P, Zhou P, Li S.",PLoS One. 2019 Mar 4;14(3):e0213295. doi: 10.1371/journal.pone.0213295. eCollection 2019.,Hao X,PLoS One,2019,2019/03/05
30832426,Can Bats Serve as Reservoirs for Arboviruses?,"Fagre AC, Kading RC.",Viruses. 2019 Mar 3;11(3):215. doi: 10.3390/v11030215.,Fagre AC,Viruses,2019,2019/03/06
30832356,Efficacy of an Adjuvanted Middle East Respiratory Syndrome Coronavirus Spike Protein Vaccine in Dromedary Camels and Alpacas,"Adney DR, Wang L, van Doremalen N, Shi W, Zhang Y, Kong WP, Miller MR, Bushmaker T, Scott D, de Wit E, Modjarrad K, Petrovsky N, Graham BS, Bowen RA, Munster VJ.",Viruses. 2019 Mar 2;11(3):212. doi: 10.3390/v11030212.,Adney DR,Viruses,2019,2019/03/06
30832341,Bat Coronaviruses in China,"Fan Y, Zhao K, Shi ZL, Zhou P.",Viruses. 2019 Mar 2;11(3):210. doi: 10.3390/v11030210.,Fan Y,Viruses,2019,2019/03/06
31251518,Early Vaccination of Chickens Induces Suboptimal Immunity Against Infectious Bronchitis Virus,"Saiada F, Eldemery F, Zegpi RA, Gulley SL, Mishra A, Santen VLV, Toro H.",Avian Dis. 2019 Mar 1;63(1):38-47. doi: 10.1637/11951-081418-Reg.1.,Saiada F,Avian Dis,2019,2019/06/29
31119115,Middle East respiratory syndrome coronavirus (MERS-CoV): A review,"Ramadan N, Shaib H.",Germs. 2019 Mar 1;9(1):35-42. doi: 10.18683/germs.2019.1155. eCollection 2019 Mar.,Ramadan N,Germs,2019,2019/05/24
31013004,Nucleotide Sequence Analysis of S1 Gene among Iranian Avian Infectious Bronchitis Viruses Isolated during 2001-2002,"Toroghi R, Salarpour A, Momayez R.",Arch Razi Inst. 2019 Mar;74(1):21-31. doi: 10.22092/ari.2019.123468.1254. Epub 2019 Mar 1.,Toroghi R,Arch Razi Inst,2019,2019/04/24
30969152,Economic Impact of the 2015 MERS Outbreak on the Republic of Korea's Tourism-Related Industries,"Joo H, Maskery BA, Berro AD, Rotz LD, Lee YK, Brown CM.",Health Secur. 2019 Mar/Apr;17(2):100-108. doi: 10.1089/hs.2018.0115. Epub 2019 Apr 10.,Joo H,Health Secur,2019,2019/04/11
30949525,"High Prevalence of Viral Infections Among Hospitalized Pneumonia Patients in Equatorial Sarawak, Malaysia","Toh TH, Hii KC, Fieldhouse JK, Ting J, Berita A, Nguyen TT, Wong SC, Wong TM, Lim WH, Ha SJ, Lau CZ, Kong SL, Bailey ES, Warkentien TE, Husain TS, Gray GC.",Open Forum Infect Dis. 2019 Feb 13;6(3):ofz074. doi: 10.1093/ofid/ofz074. eCollection 2019 Mar.,Toh TH,Open Forum Infect Dis,2019,2019/04/06
30944524,Evolutionary relationship analysis of Middle East respiratory syndrome coronavirus 4a and 4b protein coding sequences,"Kim JI, Park S, Bae JY, Park MS.",J Vet Sci. 2019 Mar;20(2):e1. doi: 10.4142/jvs.2019.20.e1. Epub 2019 Feb 19.,Kim JI,J Vet Sci,2019,2019/04/05
30922088,Frequency of diarrhoea-associated viruses in swine of various ages in Hungary,"Valkó A, Marosi A, Cságola A, Farkas R, Rónai Z, Dán Á.",Acta Vet Hung. 2019 Mar;67(1):140-150. doi: 10.1556/004.2019.016.,Valkó A,Acta Vet Hung,2019,2019/03/30
30882796,Production of Pseudotyped Particles to Study Highly Pathogenic Coronaviruses in a Biosafety Level 2 Setting,"Millet JK, Tang T, Nathan L, Jaimes JA, Hsu HL, Daniel S, Whittaker GR.",J Vis Exp. 2019 Mar 1;(145):10.3791/59010. doi: 10.3791/59010.,Millet JK,J Vis Exp,2019,2019/03/19
30827401,Evaluation and comparison of immunogenicity and cross-protective efficacy of two inactivated cell culture-derived GIIa- and GIIb-genotype porcine epidemic diarrhea virus vaccines in suckling piglets,"Liu X, Zhang L, Zhang Q, Zhou P, Fang Y, Zhao D, Feng J, Li W, Zhang Y, Wang Y.",Vet Microbiol. 2019 Mar;230:278-282. doi: 10.1016/j.vetmic.2019.02.018. Epub 2019 Feb 12.,Liu X,Vet Microbiol,2019,2019/03/05
30827386,Novel genotype of infectious bronchitis virus isolated in China,"Ma T, Xu L, Ren M, Shen J, Han Z, Sun J, Zhao Y, Liu S.",Vet Microbiol. 2019 Mar;230:178-186. doi: 10.1016/j.vetmic.2019.01.020. Epub 2019 Jan 29.,Ma T,Vet Microbiol,2019,2019/03/05
30827377,Chicken anaemia virus enhances and prolongs subsequent avian influenza (H9N2) and infectious bronchitis viral infections,"Erfan AM, Selim AA, Helmy SA, Eriksson P, Naguib MM.",Vet Microbiol. 2019 Mar;230:123-129. doi: 10.1016/j.vetmic.2019.01.024. Epub 2019 Feb 2.,Erfan AM,Vet Microbiol,2019,2019/03/05
30789338,Survey on Implementation of One Health Approach for MERS-CoV Preparedness and Control in Gulf Cooperation Council and Middle East Countries,"Farag EAB, Nour M, El Idrissi A, Berrada J, Moustafa A, Mehmood M, Mahmoud MH, El-Sayed AM, Alhajri F, Al-Hajri M, Hassan OA, Al-Romaihi H, Al-Thani M, Al-Marri SA, Koopmans MPG, Ismail MH.",Emerg Infect Dis. 2019 Mar;25(3):e171702. doi: 10.3201/eid2503.171702.,Farag EAB,Emerg Infect Dis,2019,2019/02/22
30788861,Evaluation of equine coronavirus fecal shedding among hospitalized horses,"Sanz MG, Kwon S, Pusterla N, Gold JR, Bain F, Evermann J.",J Vet Intern Med. 2019 Mar;33(2):918-922. doi: 10.1111/jvim.15449. Epub 2019 Feb 20.,Sanz MG,J Vet Intern Med,2019,2019/02/22
30771890,Forecasting herd-level porcine epidemic diarrhea (PED) frequency trends in Ontario (Canada),"Ajayi T, Dara R, Poljak Z.",Prev Vet Med. 2019 Mar 1;164:15-22. doi: 10.1016/j.prevetmed.2019.01.005. Epub 2019 Jan 12.,Ajayi T,Prev Vet Med,2019,2019/02/18
30720419,Characterization of intestinal Escherichia coli isolated from calves with diarrhea due to rotavirus and coronavirus,"Maciel JF, Matter LB, Tasca C, Scheid DAR, Gressler LT, Ziech RE, Vargas AC.",J Med Microbiol. 2019 Mar;68(3):417-423. doi: 10.1099/jmm.0.000937. Epub 2019 Feb 5.,Maciel JF,J Med Microbiol,2019,2019/02/06
30711575,Repurposing host-based therapeutics to control coronavirus and influenza virus,"Li CC, Wang XJ, Wang HR.",Drug Discov Today. 2019 Mar;24(3):726-736. doi: 10.1016/j.drudis.2019.01.018. Epub 2019 Jan 31.,Li CC,Drug Discov Today,2019,2019/02/04
30694113,Immunocytochemistry of mesenteric lymph node fine-needle aspirates in the diagnosis of feline infectious peritonitis,"Felten S, Hartmann K, Doerfelt S, Sangl L, Hirschberger J, Matiasek K.",J Vet Diagn Invest. 2019 Mar;31(2):210-216. doi: 10.1177/1040638718825280. Epub 2019 Jan 29.,Felten S,J Vet Diagn Invest,2019,2019/01/30
30688635,"Characterization of Teviot virus, an Australian bat-borne paramyxovirus","Johnson RI, Tachedjian M, Clayton BA, Layton R, Bergfeld J, Wang LF, Marsh GA.",J Gen Virol. 2019 Mar;100(3):403-413. doi: 10.1099/jgv.0.001214. Epub 2019 Jan 28.,Johnson RI,J Gen Virol,2019,2019/01/29
30684561,Prophylactic efficacy of a human monoclonal antibody against MERS-CoV in the common marmoset,"de Wit E, Feldmann F, Horne E, Okumura A, Cameroni E, Haddock E, Saturday G, Scott D, Gopal R, Zambon M, Corti D, Feldmann H.",Antiviral Res. 2019 Mar;163:70-74. doi: 10.1016/j.antiviral.2019.01.016. Epub 2019 Jan 24.,de Wit E,Antiviral Res,2019,2019/01/27
30676269,What Have We Learned About Middle East Respiratory Syndrome Coronavirus Emergence in Humans? A Systematic Literature Review,"Dawson P, Malik MR, Parvez F, Morse SS.",Vector Borne Zoonotic Dis. 2019 Mar;19(3):174-192. doi: 10.1089/vbz.2017.2191. Epub 2019 Jan 24.,Dawson P,Vector Borne Zoonotic Dis,2019,2019/01/25
30659836,Development and validation of different indirect ELISAs for MERS-CoV serological testing,"Hashem AM, Al-Amri SS, Al-Subhi TL, Siddiq LA, Hassan AM, Alawi MM, Alhabbab RY, Hindawi SI, Mohammed OB, Amor NS, Alagaili AN, Mirza AA, Azhar EI.",J Immunol Methods. 2019 Mar;466:41-46. doi: 10.1016/j.jim.2019.01.005. Epub 2019 Jan 16.,Hashem AM,J Immunol Methods,2019,2019/01/20
30632200,Disease features of equine coronavirus and enteric salmonellosis are similar in horses,"Manship AJ, Blikslager AT, Elfenbein JR.",J Vet Intern Med. 2019 Mar;33(2):912-917. doi: 10.1111/jvim.15386. Epub 2019 Jan 10.,Manship AJ,J Vet Intern Med,2019,2019/01/12
30623527,Production of porcine aminopeptidase N (pAPN) site-specific edited pigs,"Chen J, Pan K, Chen Z, Li Y, Ding B, Han C, Cao Z, Bao W, Zhang Y.",Anim Sci J. 2019 Mar;90(3):366-371. doi: 10.1111/asj.13163. Epub 2019 Jan 8.,Chen J,Anim Sci J,2019,2019/01/10
30597004,Alterations in sialic-acid O-acetylation glycoforms during murine erythrocyte development,"Mahajan VS, Alsufyani F, Mattoo H, Rosenberg I, Pillai S.",Glycobiology. 2019 Mar 1;29(3):222-228. doi: 10.1093/glycob/cwy110.,Mahajan VS,Glycobiology,2019,2019/01/01
30541861,Porcine Intestinal Enteroids: a New Model for Studying Enteric Coronavirus Porcine Epidemic Diarrhea Virus Infection and the Host Innate Response,"Li L, Fu F, Guo S, Wang H, He X, Xue M, Yin L, Feng L, Liu P.",J Virol. 2019 Feb 19;93(5):e01682-18. doi: 10.1128/JVI.01682-18. Print 2019 Mar 1.,Li L,J Virol,2019,2018/12/14
30541856,Porcine Hemagglutinating Encephalomyelitis Virus Activation of the Integrin α5β1-FAK-Cofilin Pathway Causes Cytoskeletal Rearrangement To Promote Its Invasion of N2a Cells,"Lv X, Li Z, Guan J, Hu S, Zhang J, Lan Y, Zhao K, Lu H, Song D, He H, Gao F, He W.",J Virol. 2019 Feb 19;93(5):e01736-18. doi: 10.1128/JVI.01736-18. Print 2019 Mar 1.,Lv X,J Virol,2019,2018/12/14
30531947,Origin and evolution of pathogenic coronaviruses,"Cui J, Li F, Shi ZL.",Nat Rev Microbiol. 2019 Mar;17(3):181-192. doi: 10.1038/s41579-018-0118-9.,Cui J,Nat Rev Microbiol,2019,2018/12/12
30171801,Retrospective detection and phylogenetic analysis of swine acute diarrhoea syndrome coronavirus in pigs in southern China,"Zhou L, Sun Y, Lan T, Wu R, Chen J, Wu Z, Xie Q, Zhang X, Ma J.",Transbound Emerg Dis. 2019 Mar;66(2):687-695. doi: 10.1111/tbed.13008. Epub 2019 Jan 9.,Zhou L,Transbound Emerg Dis,2019,2018/09/02
