PMID,Title,Authors,Citation,First Author,Journal/Book,Publication Year,Create Date
31436895,Characteristics of flavonoids as potent MERS-CoV 3C-like protease inhibitors,"Jo S, Kim H, Kim S, Shin DH, Kim MS.",Chem Biol Drug Des. 2019 Dec;94(6):2023-2030. doi: 10.1111/cbdd.13604. Epub 2019 Sep 12.,Jo S,Chem Biol Drug Des,2019,2019/08/23
31414403,Infectious Disease Management and Control with Povidone Iodine,Eggers M.,Infect Dis Ther. 2019 Dec;8(4):581-593. doi: 10.1007/s40121-019-00260-x. Epub 2019 Aug 14.,Eggers M,Infect Dis Ther,2019,2019/08/16
31399745,Vaccine or field strains: the jigsaw pattern of infectious bronchitis virus molecular epidemiology in Poland,"Legnardi M, Franzo G, Koutoulis KC, Wiśniewski M, Catelli E, Tucciarone CM, Cecchinato M.",Poult Sci. 2019 Dec 1;98(12):6388-6392. doi: 10.3382/ps/pez473.,Legnardi M,Poult Sci,2019,2019/08/11
31399732,Protective effects of hypericin against infectious bronchitis virus induced apoptosis and reactive oxygen species in chicken embryo kidney cells,"Chen H, Feng R, Muhammad I, Abbas G, Zhang Y, Ren Y, Huang X, Zhang R, Diao L, Wang X, Li G.",Poult Sci. 2019 Dec 1;98(12):6367-6377. doi: 10.3382/ps/pez465.,Chen H,Poult Sci,2019,2019/08/11
31307795,Effects of environmental disinfection on the isolation of vancomycin-resistant Enterococcus after a hospital-associated outbreak of Middle East respiratory syndrome,"Ko JH, Kim SH, Lee NY, Kim YJ, Cho SY, Kang CI, Chung DR, Peck KR.",Am J Infect Control. 2019 Dec;47(12):1516-1518. doi: 10.1016/j.ajic.2019.05.032. Epub 2019 Jul 12.,Ko JH,Am J Infect Control,2019,2019/07/17
31201040,A systematic review of MERS-CoV seroprevalence and RNA prevalence in dromedary camels: Implications for animal vaccination,"Dighe A, Jombart T, Van Kerkhove MD, Ferguson N.",Epidemics. 2019 Dec;29:100350. doi: 10.1016/j.epidem.2019.100350. Epub 2019 Jun 5.,Dighe A,Epidemics,2019,2019/06/16
31199168,Cross-species transmission of poultry pathogens in backyard farms: ducks as carriers of chicken viruses,"Pauly M, Snoeck CJ, Phoutana V, Keosengthong A, Sausy A, Khenkha L, Nouanthong P, Samountry B, Jutavijittum P, Vilivong K, Hübschen JM, Black AP, Pommasichan S, Muller CP.",Avian Pathol. 2019 Dec;48(6):503-511. doi: 10.1080/03079457.2019.1628919. Epub 2019 Jul 24.,Pauly M,Avian Pathol,2019,2019/06/15
31004768,Respiratory virus infection among hospitalized adult patients with or without clinically apparent respiratory infection: a prospective cohort study,"To KKW, Chan KH, Ho J, Pang PKP, Ho DTY, Chang ACH, Seng CW, Yip CCY, Cheng VCC, Hung IFN, Yuen KY.",Clin Microbiol Infect. 2019 Dec;25(12):1539-1545. doi: 10.1016/j.cmi.2019.04.012. Epub 2019 Apr 18.,To KKW,Clin Microbiol Infect,2019,2019/04/21
30943371,SARS coronavirus protein nsp1 disrupts localization of Nup93 from the nuclear pore complex,"Gomez GN, Abrar F, Dodhia MP, Gonzalez FG, Nag A.",Biochem Cell Biol. 2019 Dec;97(6):758-766. doi: 10.1139/bcb-2018-0394. Epub 2019 Apr 3.,Gomez GN,Biochem Cell Biol,2019,2019/04/04
30761819,Efficacy of gummy lozenges containing Erysimum as ancillary treatment in children with sore throat,"Bottaro G, Mazzola G, Gulino A, Di Forti F.",Minerva Pediatr. 2019 Dec;71(6):505-510. doi: 10.23736/S0026-4946.19.05405-7. Epub 2019 Feb 13.,Bottaro G,Minerva Pediatr,2019,2019/02/15
31801275,Development and Validation of a S1 Protein-Based ELISA for the Specific Detection of Antibodies against Equine Coronavirus,"Zhao S, Smits C, Schuurman N, Barnum S, Pusterla N, Kuppeveld FV, Bosch BJ, Maanen KV, Egberink H.",Viruses. 2019 Nov 30;11(12):1109. doi: 10.3390/v11121109.,Zhao S,Viruses,2019,2019/12/06
31783923,Oral vitamin A supplementation of porcine epidemic diarrhea virus infected gilts enhances IgA and lactogenic immune protection of nursing piglets,"Langel SN, Paim FC, Alhamo MA, Lager KM, Vlasova AN, Saif LJ.",Vet Res. 2019 Nov 29;50(1):101. doi: 10.1186/s13567-019-0719-y.,Langel SN,Vet Res,2019,2019/12/01
31780750,Respiratory tract infections among French Hajj pilgrims from 2014 to 2017,"Hoang VT, Ali-Salem S, Belhouchat K, Meftah M, Sow D, Dao TL, Ly TDA, Drali T, Ninove L, Yezli S, Alotaibi B, Raoult D, Parola P, Pommier de Santi V, Gautret P.",Sci Rep. 2019 Nov 28;9(1):17771. doi: 10.1038/s41598-019-54370-0.,Hoang VT,Sci Rep,2019,2019/11/30
31546302,Functional Characterization and Proteomic Analysis of Porcine Deltacoronavirus Accessory Protein NS7,"Choi S, Lee C.",J Microbiol Biotechnol. 2019 Nov 28;29(11):1817-1829. doi: 10.4014/jmb.1908.08013.,Choi S,J Microbiol Biotechnol,2019,2019/09/24
31775769,Development and comparison of enzyme-linked immunosorbent assays based on recombinant trimeric full-length and truncated spike proteins for detecting antibodies against porcine epidemic diarrhea virus,"Chang CY, Peng JY, Cheng YH, Chang YC, Wu YT, Tsai PS, Chiou HY, Jeng CR, Chang HW.",BMC Vet Res. 2019 Nov 27;15(1):421. doi: 10.1186/s12917-019-2171-7.,Chang CY,BMC Vet Res,2019,2019/11/29
31886192,Measuring Similarity among Protein Sequences Using a New Descriptor,"Abo-Elkhier MM, Abd Elwahaab MA, Abo El Maaty MI.",Biomed Res Int. 2019 Nov 22;2019:2796971. doi: 10.1155/2019/2796971. eCollection 2019.,Abo-Elkhier MM,Biomed Res Int,2019,2019/12/31
31766704,Entry of Scotophilus Bat Coronavirus-512 and Severe Acute Respiratory Syndrome Coronavirus in Human and Multiple Animal Cells,"Chen YN, Hsu HC, Wang SW, Lien HC, Lu HT, Peng SK.",Pathogens. 2019 Nov 22;8(4):259. doi: 10.3390/pathogens8040259.,Chen YN,Pathogens,2019,2019/11/27
31633330,Functional Carbon Quantum Dots as Medical Countermeasures to Human Coronavirus,"Łoczechin A, Séron K, Barras A, Giovanelli E, Belouzard S, Chen YT, Metzler-Nolte N, Boukherroub R, Dubuisson J, Szunerits S.",ACS Appl Mater Interfaces. 2019 Nov 20;11(46):42964-42974. doi: 10.1021/acsami.9b15032. Epub 2019 Nov 6.,Łoczechin A,ACS Appl Mater Interfaces,2019,2019/10/22
31752115,Characterization and Pathogenicity of the Porcine Deltacoronavirus Isolated in Southwest China,"Zhao Y, Qu H, Hu J, Fu J, Chen R, Li C, Cao S, Wen Y, Wu R, Zhao Q, Yan Q, Wen X, Huang X.",Viruses. 2019 Nov 18;11(11):1074. doi: 10.3390/v11111074.,Zhao Y,Viruses,2019,2019/11/23
31744152,A Multi-Omics Study of Chicken Infected by Nephropathogenic Infectious Bronchitis Virus,"Xu P, Liu P, Zhou C, Shi Y, Wu Q, Yang Y, Li G, Hu G, Guo X.",Viruses. 2019 Nov 16;11(11):1070. doi: 10.3390/v11111070.,Xu P,Viruses,2019,2019/11/21
31731711,Diagnosis of Feline Infectious Peritonitis: A Review of the Current Literature,"Felten S, Hartmann K.",Viruses. 2019 Nov 15;11(11):1068. doi: 10.3390/v11111068.,Felten S,Viruses,2019,2019/11/17
31687895,Prevalence of selected cardiotropic pathogens in the myocardium of adult dogs with unexplained myocardial and rhythm disorders or with congenital heart disease,"Santilli RA, Grego E, Battaia S, Gianella P, Tursi M, Di Girolamo N, Biasato I, Perego M.",J Am Vet Med Assoc. 2019 Nov 15;255(10):1150-1160. doi: 10.2460/javma.255.10.1150.,Santilli RA,J Am Vet Med Assoc,2019,2019/11/06
31462558,Peptidoglycan-Associated Cyclic Lipopeptide Disrupts Viral Infectivity,"Johnson BA, Hage A, Kalveram B, Mears M, Plante JA, Rodriguez SE, Ding Z, Luo X, Bente D, Bradrick SS, Freiberg AN, Popov V, Rajsbaum R, Rossi S, Russell WK, Menachery VD.",J Virol. 2019 Oct 29;93(22):e01282-19. doi: 10.1128/JVI.01282-19. Print 2019 Nov 15.,Johnson BA,J Virol,2019,2019/08/30
31844690,Cross-sectional investigation and risk factor analysis of community-acquired and hospital-associated canine viral infectious respiratory disease complex,"Piewbang C, Rungsipipat A, Poovorawan Y, Techangamsuwan S.",Heliyon. 2019 Nov 14;5(11):e02726. doi: 10.1016/j.heliyon.2019.e02726. eCollection 2019 Nov.,Piewbang C,Heliyon,2019,2019/12/18
31727697,"Genome Sequences of Human Coronavirus OC43 and NL63, Associated with Respiratory Infections in Kilifi, Kenya","Kamau E, Luka MM, de Laurent ZR, Adema I, Agoti CN, Nokes DJ.",Microbiol Resour Announc. 2019 Nov 14;8(46):e00730-19. doi: 10.1128/MRA.00730-19.,Kamau E,Microbiol Resour Announc,2019,2019/11/16
31727042,"The global burden of premature mortality due to the Middle East respiratory syndrome (MERS) using standard expected years of life lost, 2012 to 2019","Salamatbakhsh M, Mobaraki K, Sadeghimohammadi S, Ahmadzadeh J.",BMC Public Health. 2019 Nov 14;19(1):1523. doi: 10.1186/s12889-019-7899-2.,Salamatbakhsh M,BMC Public Health,2019,2019/11/16
31766215,Delmarva (DMV/1639) Infectious Bronchitis Virus (IBV) Variants Isolated in Eastern Canada Show Evidence of Recombination,"Hassan MSH, Ojkic D, Coffin CS, Cork SC, van der Meer F, Abdul-Careem MF.",Viruses. 2019 Nov 13;11(11):1054. doi: 10.3390/v11111054.,Hassan MSH,Viruses,2019,2019/11/27
31730910,MERS-CoV as an emerging respiratory illness: A review of prevention methods,"Baharoon S, Memish ZA.",Travel Med Infect Dis. 2019 Nov 12;32:101520. doi: 10.1016/j.tmaid.2019.101520. Online ahead of print.,Baharoon S,Travel Med Infect Dis,2019,2019/11/16
31718620,Development of indirect enzyme-linked immunosorbent assay for detection of porcine epidemic diarrhea virus specific antibodies (IgG) in serum of naturally infected pigs,"Myint O, Yoshida A, Sekiguchi S, Van Diep N, Fuke N, Izzati UZ, Hirai T, Yamaguchi R.",BMC Vet Res. 2019 Nov 12;15(1):409. doi: 10.1186/s12917-019-2123-2.,Myint O,BMC Vet Res,2019,2019/11/14
31706335,Evolution of infectious bronchitis virus in the field after homologous vaccination introduction,"Franzo G, Legnardi M, Tucciarone CM, Drigo M, Martini M, Cecchinato M.",Vet Res. 2019 Nov 9;50(1):92. doi: 10.1186/s13567-019-0713-4.,Franzo G,Vet Res,2019,2019/11/11
31705137,Humoral Immunogenicity and Efficacy of a Single Dose of ChAdOx1 MERS Vaccine Candidate in Dromedary Camels,"Alharbi NK, Qasim I, Almasoud A, Aljami HA, Alenazi MW, Alhafufi A, Aldibasi OS, Hashem AM, Kasem S, Albrahim R, Aldubaib M, Almansour A, Temperton NJ, Kupke A, Becker S, Abu-Obaidah A, Alkarar A, Yoon IK, Azhar E, Lambe T, Bayoumi F, Aldowerij A, Ibrahim OH, Gilbert SC, Balkhy HH.",Sci Rep. 2019 Nov 8;9(1):16292. doi: 10.1038/s41598-019-52730-4.,Alharbi NK,Sci Rep,2019,2019/11/10
31703698,Epitope-based peptide vaccine design and target site depiction against Middle East Respiratory Syndrome Coronavirus: an immune-informatics study,"Tahir Ul Qamar M, Saleem S, Ashfaq UA, Bari A, Anwar F, Alqahtani S.",J Transl Med. 2019 Nov 8;17(1):362. doi: 10.1186/s12967-019-2116-8.,Tahir Ul Qamar M,J Transl Med,2019,2019/11/10
31819541,Estimation Of Direct Medical Costs Of Middle East Respiratory Syndrome Coronavirus Infection: A Single-Center Retrospective Chart Review Study,"AlRuthia Y, Somily AM, Alkhamali AS, Bahari OH, AlJuhani RJ, Alsenaidy M, Balkhi B.",Infect Drug Resist. 2019 Nov 7;12:3463-3473. doi: 10.2147/IDR.S231087. eCollection 2019.,AlRuthia Y,Infect Drug Resist,2019,2019/12/11
31694296,The Porcine Deltacoronavirus Replication Organelle Comprises Double-Membrane Vesicles and Zippered Endoplasmic Reticulum with Double-Membrane Spherules,"Doyle N, Hawes PC, Simpson J, Adams LH, Maier HJ.",Viruses. 2019 Nov 5;11(11):1030. doi: 10.3390/v11111030.,Doyle N,Viruses,2019,2019/11/08
31690059,"Natural Bis-Benzylisoquinoline Alkaloids-Tetrandrine, Fangchinoline, and Cepharanthine, Inhibit Human Coronavirus OC43 Infection of MRC-5 Human Lung Cells","Kim DE, Min JS, Jang MS, Lee JY, Shin YS, Song JH, Kim HR, Kim S, Jin YH, Kwon S.",Biomolecules. 2019 Nov 4;9(11):696. doi: 10.3390/biom9110696.,Kim DE,Biomolecules,2019,2019/11/07
31690009,Engineering a Novel Antibody-Peptide Bispecific Fusion Protein Against MERS-CoV,"Wang L, Xu J, Kong Y, Liang R, Li W, Li J, Lu J, Dimitrov DS, Yu F, Wu Y, Ying T.",Antibodies (Basel). 2019 Nov 4;8(4):53. doi: 10.3390/antib8040053.,Wang L,Antibodies (Basel),2019,2019/11/07
31689903,Emerging Highly Virulent Porcine Epidemic Diarrhea Virus: Molecular Mechanisms of Attenuation and Rational Design of Live Attenuated Vaccines,"Hou Y, Wang Q.",Int J Mol Sci. 2019 Nov 4;20(21):5478. doi: 10.3390/ijms20215478.,Hou Y,Int J Mol Sci,2019,2019/11/07
31684870,Identification and analysis of long non-coding RNAs that are involved in inflammatory process in response to transmissible gastroenteritis virus infection,"Ma X, Zhao X, Wang K, Tang X, Guo J, Mi M, Qi Y, Chang L, Huang Y, Tong D.",BMC Genomics. 2019 Nov 4;20(1):806. doi: 10.1186/s12864-019-6156-5.,Ma X,BMC Genomics,2019,2019/11/06
31781594,Manipulation of Intestinal Antiviral Innate Immunity and Immune Evasion Strategies of Porcine Epidemic Diarrhea Virus,"Du J, Luo J, Yu J, Mao X, Luo Y, Zheng P, He J, Yu B, Chen D.",Biomed Res Int. 2019 Nov 3;2019:1862531. doi: 10.1155/2019/1862531. eCollection 2019.,Du J,Biomed Res Int,2019,2019/11/30
31684062,Significant Interference with Porcine Epidemic Diarrhea Virus Pandemic and Classical Strain Replication in Small-Intestine Epithelial Cells Using an shRNA Expression Vector,"Shi D, Wang X, Shi H, Zhang J, Han Y, Chen J, Zhang X, Liu J, Zhang J, Ji Z, Jing Z, Feng L.",Vaccines (Basel). 2019 Nov 2;7(4):173. doi: 10.3390/vaccines7040173.,Shi D,Vaccines (Basel),2019,2019/11/06
32289017,Rapid multiplex microfiber-based immunoassay for anti-MERS-CoV antibody detection,"Hoy CFO, Kushiro K, Yamaoka Y, Ryo A, Takai M.",Sens Biosensing Res. 2019 Nov;26:100304. doi: 10.1016/j.sbsr.2019.100304. Epub 2019 Oct 14.,Hoy CFO,Sens Biosensing Res,2019,2020/04/15
32009759,Isolation and characterization of avian coronavirus from healthy Eclectus parrots (Eclectus roratus) from Indonesia,"Suryaman GK, Soejoedono RD, Setiyono A, Poetri ON, Handharyani E.",Vet World. 2019 Nov;12(11):1797-1805. doi: 10.14202/vetworld.2019.1797-1805. Epub 2019 Nov 19.,Suryaman GK,Vet World,2019,2020/02/04
31903251,Molecular epidemiology of respiratory viruses among Malaysian Young children with a confirmed respiratory infection during 2014-2015,"Yew SM, Tan KL, Yeo SK, Ng KP, Kuan CS.",J Thorac Dis. 2019 Nov;11(11):4626-4633. doi: 10.21037/jtd.2019.10.69.,Yew SM,J Thorac Dis,2019,2020/01/07
31796154,"Middle East respiratory syndrome coronavirus (MERS-CoV) neutralising antibodies in a high-risk human population, Morocco, November 2017 to January 2018","Abbad A, Perera RA, Anga L, Faouzi A, Minh NNT, Malik SMMR, Iounes N, Maaroufi A, Van Kerkhove MD, Peiris M, Nourlil J.",Euro Surveill. 2019 Nov;24(48):1900244. doi: 10.2807/1560-7917.ES.2019.24.48.1900244.,Abbad A,Euro Surveill,2019,2019/12/05
31775197,"Enhancement of antigen-specific humoral immune responses and protein solubility through conjugation of bacterial flagellin, Vibrio vulnificus FlaB, to the N-terminus of porcine epidemic diarrhea virus surface protein antigen S0","Oh SH, Kim Cho YS, Lee HB, Lee SM, Kim WS, Hong L, Cho CS, Choi YJ, Kang SK.",J Vet Sci. 2019 Nov;20(6):e70. doi: 10.4142/jvs.2019.20.e70.,Oh SH,J Vet Sci,2019,2019/11/28
31775191,Causative agents and epidemiology of diarrhea in Korean native calves,"Lee SH, Kim HY, Choi EW, Kim D.",J Vet Sci. 2019 Nov;20(6):e64. doi: 10.4142/jvs.2019.20.e64.,Lee SH,J Vet Sci,2019,2019/11/28
31696140,Comparison of Rates of Hospitalization Between Single and Dual Virus Detection in a Mexican Cohort of Children and Adults With Influenza-Like Illness,"Noyola DE, Hunsberger S, Valdés Salgado R, Powers JH 3rd, Galindo-Fraga A, Ortiz-Hernández AA, Ramirez-Venegas A, Moreno-Espinosa S, Llamosas-Gallardo B, Guerrero ML, Beigel JH, Ruiz-Palacios G, Perez-Patrigeon S; Mexico Emerging Infectious Diseases Clinical Research Network ILI-002 Study Group.",Open Forum Infect Dis. 2019 Oct 3;6(11):ofz424. doi: 10.1093/ofid/ofz424. eCollection 2019 Nov.,Noyola DE,Open Forum Infect Dis,2019,2019/11/08
31682559,Detecting Emerging Infectious Diseases: An Overview of the Laboratory Response Network for Biological Threats,"Villanueva J, Schweitzer B, Odle M, Aden T.",Public Health Rep. 2019 Nov/Dec;134(2_suppl):16S-21S. doi: 10.1177/0033354919874354.,Villanueva J,Public Health Rep,2019,2019/11/05
31675966,The immune response of young turkeys to haemorrhagic enteritis virus infection at different levels and sources of methionine in the diet,"Tykałowski B, Śmiałek M, Koncicki A, Ognik K, Zduńczyk Z, Jankowski J.",BMC Vet Res. 2019 Nov 1;15(1):387. doi: 10.1186/s12917-019-2138-8.,Tykałowski B,BMC Vet Res,2019,2019/11/03
31650901,"One-step triplex reverse-transcription PCR detection of porcine epidemic diarrhea virus, porcine sapelovirus, and porcine sapovirus","Jiang C, He H, Zhang C, Zhang X, Han J, Zhang H, Luo Y, Wu Y, Wang Y, Ge B, Xu J.",J Vet Diagn Invest. 2019 Nov;31(6):909-912. doi: 10.1177/1040638719883834. Epub 2019 Oct 25.,Jiang C,J Vet Diagn Invest,2019,2019/10/26
31592752,Isolation and growth characterization of novel full length and deletion mutant human MERS-CoV strains from clinical specimens collected during 2015,"Tamin A, Queen K, Paden CR, Lu X, Andres E, Sakthivel SK, Li Y, Tao Y, Zhang J, Kamili S, Assiri AM, Alshareef A, Alaifan TA, Altamimi AM, Jokhdar H, Watson JT, Gerber SI, Tong S, Thornburg NJ.",J Gen Virol. 2019 Nov;100(11):1523-1529. doi: 10.1099/jgv.0.001334.,Tamin A,J Gen Virol,2019,2019/10/09
31560964,Antiviral activity of Sambucus FormosanaNakai ethanol extract and related phenolic acid constituents against human coronavirus NL63,"Weng JR, Lin CS, Lai HC, Lin YP, Wang CY, Tsai YC, Wu KC, Huang SH, Lin CW.",Virus Res. 2019 Nov;273:197767. doi: 10.1016/j.virusres.2019.197767. Epub 2019 Sep 24.,Weng JR,Virus Res,2019,2019/09/28
31539770,Generating and evaluating type I interferon receptor-deficient and feline TMPRSS2-expressing cells for propagating serotype I feline infectious peritonitis virus,"Mettelman RC, O'Brien A, Whittaker GR, Baker SC.",Virology. 2019 Nov;537:226-236. doi: 10.1016/j.virol.2019.08.030. Epub 2019 Aug 30.,Mettelman RC,Virology,2019,2019/09/21
31526204,Predictors of response to augmentation treatment in patients with treatment-resistant depression: A systematic review,"Taylor RW, Marwood L, Greer B, Strawbridge R, Cleare AJ.",J Psychopharmacol. 2019 Nov;33(11):1323-1339. doi: 10.1177/0269881119872194. Epub 2019 Sep 17.,Taylor RW,J Psychopharmacol,2019,2019/09/19
31518629,Epitope mapping and cellular localization of swine acute diarrhea syndrome coronavirus nucleocapsid protein using a novel monoclonal antibody,"Han Y, Zhang J, Shi H, Zhou L, Chen J, Zhang X, Liu J, Zhang J, Wang X, Ji Z, Jing Z, Cong G, Ma J, Shi D, Li F.",Virus Res. 2019 Nov;273:197752. doi: 10.1016/j.virusres.2019.197752. Epub 2019 Sep 10.,Han Y,Virus Res,2019,2019/09/14
31505321,Coronavirus genomic RNA packaging,Masters PS.,Virology. 2019 Nov;537:198-207. doi: 10.1016/j.virol.2019.08.031. Epub 2019 Aug 30.,Masters PS,Virology,2019,2019/09/11
31472338,Ambient ammonia does not appear to inhibit the immune response to infectious bronchitis virus vaccination and protection from homologous challenge in broiler chickens,"Aston EJ, Jackwood MW, Gogal RM Jr, Hurley DJ, Fairchild BD, Hilt DA, Cheng S, Tensa LR, Garcia M, Jordan BJ.",Vet Immunol Immunopathol. 2019 Nov;217:109932. doi: 10.1016/j.vetimm.2019.109932. Epub 2019 Aug 23.,Aston EJ,Vet Immunol Immunopathol,2019,2019/09/01
31456086,"Bovine coronavirus in Uruguay: genetic diversity, risk factors and transboundary introductions from neighboring countries","Castells M, Giannitti F, Caffarena RD, Casaux ML, Schild C, Castells D, Riet-Correa F, Victoria M, Parreño V, Colina R.",Arch Virol. 2019 Nov;164(11):2715-2724. doi: 10.1007/s00705-019-04384-w. Epub 2019 Aug 27.,Castells M,Arch Virol,2019,2019/08/29
31455974,[Coronaviruses as the cause of respiratory infections],"Corman VM, Lienau J, Witzenrath M.",Internist (Berl). 2019 Nov;60(11):1136-1145. doi: 10.1007/s00108-019-00671-5.,Corman VM,Internist (Berl),2019,2019/08/29
31430248,"Middle East Respiratory Syndrome Coronavirus, Saudi Arabia, 2017-2018","Hakawi A, Rose EB, Biggs HM, Lu X, Mohammed M, Abdalla O, Abedi GR, Alsharef AA, Alamri AA, Bereagesh SA, Al Dosari KM, Ashehri SA, Fakhouri WG, Alzaid SZ, Lindstrom S, Gerber SI, Asiri A, Jokhdar H, Watson JT.",Emerg Infect Dis. 2019 Nov;25(11):2149-2151. doi: 10.3201/eid2511.190726. Epub 2019 Nov 17.,Hakawi A,Emerg Infect Dis,2019,2019/08/21
31385116,Interferon gamma inhibits transmissible gastroenteritis virus infection mediated by an IRF1 signaling pathway,"Shan L, Fu F, Xue M, Zhu X, Li L, Feng L, Liu P.",Arch Virol. 2019 Nov;164(11):2659-2669. doi: 10.1007/s00705-019-04362-2. Epub 2019 Aug 5.,Shan L,Arch Virol,2019,2019/08/07
31375588,Establishment of a Virulent Full-Length cDNA Clone for Type I Feline Coronavirus Strain C3663,"Terada Y, Kuroda Y, Morikawa S, Matsuura Y, Maeda K, Kamitani W.",J Virol. 2019 Oct 15;93(21):e01208-19. doi: 10.1128/JVI.01208-19. Print 2019 Nov 1.,Terada Y,J Virol,2019,2019/08/04
31265112,Simultaneous and visual detection of infectious bronchitis virus and Newcastle disease virus by multiple LAMP and lateral flow dipstick,"Wu X, Song Z, Zhai X, Zuo L, Mei X, Xiang R, Kang Z, Zhou L, Wang H.",Poult Sci. 2019 Nov 1;98(11):5401-5411. doi: 10.3382/ps/pez372.,Wu X,Poult Sci,2019,2019/07/03
31264704,Molecular epidemiology of infectious bronchitis virus and avian metapneumovirus in Greece,"Andreopoulou M, Franzo G, Tucciarone CM, Prentza Z, Koutoulis KC, Cecchinato M, Chaligianni I.",Poult Sci. 2019 Nov 1;98(11):5374-5384. doi: 10.3382/ps/pez360.,Andreopoulou M,Poult Sci,2019,2019/07/03
31255833,Molecular and biological characteristics of the infectious bronchitis virus TC07-2/GVI-1 lineage isolated in China,"Ren M, Sheng J, Ma T, Xu L, Han Z, Li H, Zhao Y, Sun J, Liu S.",Infect Genet Evol. 2019 Nov;75:103942. doi: 10.1016/j.meegid.2019.103942. Epub 2019 Jun 27.,Ren M,Infect Genet Evol,2019,2019/07/01
31222258,Molecular characteristics and pathogenicity analysis of QX-like avian infectious bronchitis virus isolated in China in 2017 and 2018,"Yan S, Sun Y, Huang X, Jia W, Xie D, Zhang G.",Poult Sci. 2019 Nov 1;98(11):5336-5341. doi: 10.3382/ps/pez351.,Yan S,Poult Sci,2019,2019/06/22
31006635,Diagnostic delays in Middle East respiratory syndrome coronavirus patients and health systems,Ahmed AE.,J Infect Public Health. 2019 Nov-Dec;12(6):767-771. doi: 10.1016/j.jiph.2019.04.002. Epub 2019 Apr 18.,Ahmed AE,J Infect Public Health,2019,2019/04/23
30945121,A phase I/II study of poziotinib combined with paclitaxel and trastuzumab in patients with HER2-positive advanced gastric cancer,"Kim TY, Han HS, Lee KW, Zang DY, Rha SY, Park YI, Kim JS, Lee KH, Park SH, Song EK, Jung SA, Lee N, Kim YH, Cho JY, Bang YJ.",Gastric Cancer. 2019 Nov;22(6):1206-1214. doi: 10.1007/s10120-019-00958-4. Epub 2019 Apr 3.,Kim TY,Gastric Cancer,2019,2019/04/05
30826285,Early respiratory viral infections in infants with cystic fibrosis,"Deschamp AR, Hatch JE, Slaven JE, Gebregziabher N, Storch G, Hall GL, Stick S, Ranganathan S, Ferkol TW, Davis SD.",J Cyst Fibros. 2019 Nov;18(6):844-850. doi: 10.1016/j.jcf.2019.02.004. Epub 2019 Feb 27.,Deschamp AR,J Cyst Fibros,2019,2019/03/04
32084023,"Middle East Respiratory Syndrome Coronavirus epidemic impact on healthcare workers' risk perceptions, work and personal lives","Alsubaie S, Hani Temsah M, Al-Eyadhy AA, Gossady I, Hasan GM, Al-Rabiaah A, Jamal AA, Alhaboob AA, Alsohime F, Somily AM.",J Infect Dev Ctries. 2019 Oct 31;13(10):920-926. doi: 10.3855/jidc.11753.,Alsubaie S,J Infect Dev Ctries,2019,2020/02/22
31683569,"Analysis of Swine Conventional Dendritic Cells, DEC205(+)CD172a(+/-)CADM1(+), from Blood and Spleen in Response to PRRSV and PEDV","Parra-Sánchez H, Bustamante-Córdova L, Reséndiz M, Mata-Haro V, Pinelli-Saavedra A, Hernández J.",Viruses. 2019 Oct 31;11(11):1001. doi: 10.3390/v11111001.,Parra-Sánchez H,Viruses,2019,2019/11/06
31666061,Risk of transmission via medical employees and importance of routine infection-prevention policy in a nosocomial outbreak of Middle East respiratory syndrome (MERS): a descriptive analysis from a tertiary care hospital in South Korea,"Ki HK, Han SK, Son JS, Park SO.",BMC Pulm Med. 2019 Oct 30;19(1):190. doi: 10.1186/s12890-019-0940-5.,Ki HK,BMC Pulm Med,2019,2019/11/01
31736943,Mutation of an L-Type Calcium Channel Gene Leads to T Lymphocyte Dysfunction,"Fenninger F, Han J, Stanwood SR, Nohara LL, Arora H, Choi KB, Munro L, Pfeifer CG, Shanina I, Horwitz MS, Jefferies WA.",Front Immunol. 2019 Oct 29;10:2473. doi: 10.3389/fimmu.2019.02473. eCollection 2019.,Fenninger F,Front Immunol,2019,2019/11/19
31660993,Characterization and pathogenicity of Vero cell-attenuated porcine epidemic diarrhea virus CT strain,"Wu Y, Li W, Zhou Q, Li Q, Xu Z, Shen H, Chen F.",Virol J. 2019 Oct 28;16(1):121. doi: 10.1186/s12985-019-1232-7.,Wu Y,Virol J,2019,2019/10/30
31650956,The human coronavirus HCoV-229E S-protein structure and receptor binding,"Li Z, Tomlinson AC, Wong AH, Zhou D, Desforges M, Talbot PJ, Benlekbir S, Rubinstein JL, Rini JM.",Elife. 2019 Oct 25;8:e51230. doi: 10.7554/eLife.51230.,Li Z,Elife,2019,2019/10/26
31653070,Identification of a Novel Betacoronavirus (Merbecovirus) in Amur Hedgehogs from China,"Lau SKP, Luk HKH, Wong ACP, Fan RYY, Lam CSF, Li KSM, Ahmed SS, Chow FWN, Cai JP, Zhu X, Chan JFW, Lau TCK, Cao K, Li M, Woo PCY, Yuen KY.",Viruses. 2019 Oct 24;11(11):980. doi: 10.3390/v11110980.,Lau SKP,Viruses,2019,2019/10/27
31652964,Viral Metagenomics Revealed Sendai Virus and Coronavirus Infection of Malayan Pangolins (Manis javanica),"Liu P, Chen W, Chen JP.",Viruses. 2019 Oct 24;11(11):979. doi: 10.3390/v11110979.,Liu P,Viruses,2019,2019/10/27
31647831,The respiratory virome and exacerbations in patients with chronic obstructive pulmonary disease,"van Rijn AL, van Boheemen S, Sidorov I, Carbo EC, Pappas N, Mei H, Feltkamp M, Aanerud M, Bakke P, Claas ECJ, Eagan TM, Hiemstra PS, Kroes ACM, de Vries JJC.",PLoS One. 2019 Oct 24;14(10):e0223952. doi: 10.1371/journal.pone.0223952. eCollection 2019.,van Rijn AL,PLoS One,2019,2019/10/25
